appId,title,developer,score,reviews_count,installs,free,price,currency,updated,genre,contentRating,minInstalls,maxInstalls,summary,most_liked_review,most_disliked_review,discovered_from_category,discovered_query
com.amazon.avod.thirdpartyclient,Prime Video,Amazon Mobile LLC,4.045947,4969850,"500,000,000+",True,0,USD,1756857311,Entertainment,Teen,500000000,,"Watch movies, TV shows, live programming, and sports","There's only some good shows, most of which are an extra charge because they aren't actually on this platform (so you're getting half-catfished). The ads are the final straw for me though. How greedy can you be?!? Amazon has so much money, but it will apparently never be enough. I'm already paying to use this streaming service at all, so there's no way I'm gonna pay even more just so I won't have ads. Also the ads are incredibly long, and incredibly often. This is ridiculous","I have been paying for Amazon Prime for many years now. Given that the service is paid for, I see no valid reason for the introduction of ads. The past few months, I had paid the additional fee to not see any ads. There were still some ads, nonetheless. I decided to stop spending even more money for something that's still happening anyway. Now, the ridiculous number of commercials, plus movies restarting, making me watch even more ads, I'm will not be renewing my subscription once it runs out.",ENTERTAINMENT,entertainment apps
com.google.android.youtube,YouTube,Google LLC,3.9474628,165521064,"10,000,000,000+",True,0,USD,1756522938,Video Players & Editors,Teen,10000000000,,Enjoy your favorite videos and channels with the official YouTube app.,"Way to many commercials. Literally if you try to watch 10 mins of YouTube content in general, you will at least watch 10 commercials in the time frame , and almost all of them pop up right when something important happens in an educational video or a good part in someone's content , and then you have to rewind to watch it again with out the commercials. update added , it's gotten even worse . you get ads now even if you pause a video . , you can't even watch the content anymore","I've used YouTube for well over 10 years now. There's an ad on everything, everywhere you go, or look, has an ad or rather, multiple ads. Honestly, there's no saving YouTube from them anymore. I frequently get ads on videos under a minute long and ads even disrupt listening to music as well. I spend more time seeing and listening to ads than actually watching and enjoying the videos on the platform. Whatever YouTube might've been before is dead, with ads puppeting its corpse.",ENTERTAINMENT,entertainment apps
com.disney.disneyplus,Disney+,Disney,4.397446,4810051,"100,000,000+",True,0,USD,1756235906,Entertainment,Teen,100000000,,"Stream and download your favorite movies, TV shows & Originals on Disney+","App works great! I cannot only afford the ad supported payment plan. I understand that ads will be subsiding my monthly fee. However, is it really necessary to have up to 4 or 5 1:30 to 3:00 mins advertisements during a show that lasts about 24 mins? I know movies and shows are expensive. But Disney is richer than many countries out there, surely there is a better balance to be found. One that doesn't break the bank or ones peace of mind watching the same 2 ads again & again-ad infinitum.","This app works like garbage, honestly. The content is only worth the nostalgic classics. I will play a movie, pause it and come back later, and it never resumes from where it was paused. Every single time it starts over from the the beginning and I have to sit through an insane amount of ads to fast forward to my guesstimated spot. If it's past a built in ad break, I'm watching way way more ads than I should have to in order to RESUME a movie. How is it THIS garbage?",ENTERTAINMENT,entertainment apps
com.spotify.music,Spotify: Music and Podcasts,Spotify AB,4.334475,34081029,"1,000,000,000+",True,0,USD,1756808077,Music & Audio,Teen,1000000000,,"Listen to songs, play podcasts, create playlists and discover music you'll love","""30mins of free listening after this ad"" Four minutes later, I get even more ads. Don't lie to me. It has potential but you need premium to get decent features. Even with premium, I'm still having trouble with the app. I used offline mode while I travel for work and half the time my playlists won't play. I tried listening to a podcast and I get ""playback failed"" even though the episode is downloaded to my phone.","I only used Spotify to listen to the podcast version of an actual radio show, The Woody Show. Like all shows on the radio, they play snippets of music coming in and out of break. For this ridiculous reason, Spotify has removed them for an extended period of time. Fortunately, there are many other apps out there that work properly, such as the iheart radio app.",MUSIC_AND_AUDIO,music and audio apps
com.amazon.mp3,Amazon Music: Songs & Podcasts,Amazon Mobile LLC,3.6022124,3237571,"100,000,000+",True,0,USD,1756708204,Music & Audio,Teen,100000000,,"Listen to podcasts, trending playlists, hit music and your favorite songs","App closes or crashes regularly. This used to happen occasionally but has become a common occurrence lately. Subscription is great, and the library is huge, but not being able to listen to music without needing to restart the app is horrible. Please fix this problem! Update as of 2025, app crashes continue to be a problem. it is unclear why the app will suddenly stop working, but relaunch and can listen until next crash. minutes to hours. The behavior seems like a way to force me to see ad's","This app has been absolutely awful. At least once a week, I have an issue with it. I've had to delete it and redownload it at least four times, and every time, it un-downloads all my music so I need to redownload everything. I'm currently redownloading my songs again, but now it's doing this cute and quirky thing where when I download a song IT DELETES IT FROM MY LIBRARY!!! The only reason I'm still using this god forsaken app is because my parents are paying for it.",MUSIC_AND_AUDIO,music and audio apps
com.soundcloud.android,SoundCloud: The Music You Love,SoundCloud,4.6664634,7382402,"100,000,000+",True,0,USD,1757061666,Music & Audio,Teen,100000000,,Where mixtapes meet DJ sets & fresh sounds. Discover songs & tracks you love!,"I love how there are sped up/ slowed down versions of songs. I've used SoundCloud for only a year now, but I much recommend this over Spotify. It sucks how it's not on Xbox, though! Its also a bit annoying when you have to pay for the premium subscription for certain songs. But otherwise, it's a perfect music streaming app! 110% recommend edit: having lyrics would be super cool! the one thing Spotify has that this doesn't 😓 otherwise still doing me well!","Unable to cancel subscription. SoundCloud says go to the app store and I find no subscription there. Seems like they're trying robbing people of their money, or make it very difficult to cancel. Once again, I can't find the subscription and it feels like it's intentional. Would not recommend getting a subscription, unless you want to get a new card to stop paying thieves, which I have to do now. Decent app, YT is better. Big L from soundcloud.",MUSIC_AND_AUDIO,music and audio apps
com.google.android.apps.youtube.music,YouTube Music,Google LLC,4.5697145,6881662,"5,000,000,000+",True,0,USD,1757030881,Music & Audio,Teen,5000000000,,The world of music dedicated to you,"I've been using YouTube Music since it was created, over a decade now. YouTube Music has played an essential role in the latter half of my life, and other than occasional frustration with the song recommendation algorithm, I think it's perfect. I just hope it doesn't choose to change everything and cram ""AI"" down our throats, the way other things have been doing. Keep practicing one kick 10,000 times instead of 10,000 kicks once, YouTube Music.","The free version is actually horrendous. Ads after every song/play of a song, if you get an ad, skip it and then select another song, it gives you another ad, most ads have a drop-down box with a link to their website that prevents you from swiping the 'currently listening' box down to pick a different song, said drop-down box doesn't close automatically if the ad ends or is skipped. The literal only good thing about the free version is that you can listen to music, everything else is terrible",MUSIC_AND_AUDIO,music and audio apps
com.apple.android.music,Apple Music,Apple,4.5854125,664082,"100,000,000+",True,0,USD,1753925560,Music & Audio,Teen,100000000,,"Stream over 100 million songs, all ad-free.","I really wish my ""downloaded"" music didn't constantly get frozen in buffering. Every hour or so I have to take out my phone and skip a song that refuses to play. Even if it wasn't downloaded I have great signal most of the time, so it's obviously a problem with their UI/music player. It's been broken for the last five years, so I doubt it'll get fixed any time soon.","I really wish my ""downloaded"" music didn't constantly get frozen in buffering. Every hour or so I have to take out my phone and skip a song that refuses to play. Even if it wasn't downloaded I have great signal most of the time, so it's obviously a problem with their UI/music player. It's been broken for the last five years, so I doubt it'll get fixed any time soon.",MUSIC_AND_AUDIO,music and audio apps
com.amazon.mShop.android.shopping,Amazon Shopping,Amazon Mobile LLC,4.4446945,4272934,"500,000,000+",True,0,USD,1755627906,Shopping,Teen,500000000,,"Browse, search & buy millions of products right from your Android device.","Look, Amazon is Amazon and it's app isn't all that different from it's website from a mobile standpoint. But now they're putting ads into your notification bar. They could section off ""deals picked for you"" notifs and ""delivery update"" notifs, but they don't. Lumping these two kinds of notifications together without an option to toggle them is ignorant at best and manipulative at worst. I just need quick delivery updates, nothing else, and I don't need an app that can't or won't do just that.","The last two months, Amazon has been messing up orders left & right. Not sure what's going on, but they owe me some money for sending incorrect items in multiple orders. App design makes customer service on these issues ridiculously hard to find. All dealings with specific orders should be available on the same page for orders/reviews. It was a great shopping app until May 2025.",SHOPPING,shopping apps
com.contextlogic.wish,Wish: Shop and Save,Wish US Holdings LLC,4.6738586,14439281,"500,000,000+",True,0,USD,1756902648,Shopping,Teen,500000000,,"Home & Life, Fashion, Electronics","Great selection of products for less. Shipping costs are on the high side, much higher than the product you are buying most of the time. I have a membership, so some items are shipped for free. I think having to pay $5.99 a month for membership should get you free shipping on EVERYTHING but it doesn't. Items arrive quicker than they used to, which is always a plus. If you don't get the exact product you order, color, design etc, you get a refund on it which I love. It has only happened 1 time.","wish has become entirely useless. Even something like an Xbox 360 controller ($20 back in the day) costs $50. Useless app that's not even good for the only thing it used to be food for. Cheap low-quality items. instead, now they're expensive low-quality items. (They will surely respond that items have gone up in quality. I can assure you from personal experience they have not.)",SHOPPING,shopping apps
com.alibaba.aliexpresshd,AliExpress - Shopping App,Alibaba Mobile,4.451743,16199605,"500,000,000+",True,0,USD,1756958031,Shopping,Teen,500000000,,Shop smart anytime with aliexpress — your online shop app.,"Easy experience the last few years. Have done some shopping for tech parts you wouldn't really find in the US. I went up to buying figurines and have not had an error in my orders, all parts were always included. The deals are what brings me back, some very costly items can be up to half off if you play your cards right, just make use of the games to get coins!","they tripled the prices for the same quality. Amazon is much more convenient. on Aliexpress I was charged for a tax that was never set in place only because the US was thinking to add it, but never did. and they asked me as proof an invoice they never sent. I asked where can I find the invoice and their answer was ""we're closing the ticket because we didn't hear from you"". I used to love AliExpress, their customer support was the best and the prices were great for the quality offered.",SHOPPING,shopping apps
com.zzkko,SHEIN-Shopping Online,Roadget Business PTE. LTD.,3.876897,6495753,"500,000,000+",True,0,USD,1756914801,Shopping,Teen,500000000,,Save money. Live in style!,"My first order was great. I ordered 4 items (2 clothing) and they were all great quality. This last time I ordered, all three clothing items were cheaply made (though they cost more), itchy, and awful. Also, I don't like their return policy. The first item of each order is free to return but after that, each item has a $7 fee. Not worth it if the item is $10 or lower.","I add an item to my cart, then when I select it to do final checkout - the price increases. Sometimes doubling. That is so shady. I don't want to be shown an ""Estimated price"", when it isn't even anywhere NEAR that price when I actually try to buy it. I enjoy shopping on Shein, but I've noticed this for a while now and it makes it confusing and honestly makes you not want to even look at stuff. I'm not the only one that has noticed this, either. Multiple other people have noticed it as well.",SHOPPING,shopping apps
com.ebay.mobile,eBay online shopping & selling,eBay Mobile,4.653425,4960954,"100,000,000+",True,0,USD,1756418579,Shopping,Teen,100000000,,"Buy, sell & resell marketplace. Clothes, sneakers & tech. Download now!","I've been using ebay since 1999, buying and selling. I've gone through so many iterations of the site, mostly improvements. The app is great - the search tool works the same as the website, it's easy to make a purchase or post an item, keep track of your purchases or inventory. I just wish there was a way to block mega sellers when you're looking for a true vintage or authentic item. Otherwise fast accurate, easy to use.","I can change notification settings now. I disabled notifications for ebay lives and I still get them! also I reported an item for manipulating search results, listing with the wrong item condition (i.e listed as ""pre-owned"" but the title and desc. say ""for Parts&Repair"") got an email saying the AI didn't find anything despite that the item name in the same email said ""PARTS ONLY"". yes, it's in all caps in the item name. How did this go over the AI's head?! Stop giving me tiny shipping labels!!",SHOPPING,shopping apps
