appId,title,developer,score,reviews_count,installs,free,price,currency,updated,genre,contentRating,minInstalls,maxInstalls,summary,most_liked_review,most_disliked_review,discovered_from_category,discovered_query
com.google.android.calendar,Google Calendar,Google LLC,4.632835,3985283,"5,000,000,000+",True,0,USD,1756987547,Productivity,Everyone,5000000000,,"Make the most of your day with Google Calendar, part of Google Workspace","I looove this app a lot! From scheduling my to-do list up to my business stuff. I just don't know if this is an issue on my phone but sometimes when I will add a task, it will randomly have glitches. Like, when i select the 'All day' option, the 'task' will be converted as 'event' or when I click 'save', nothing happens.","Calendar is now switching to my work account when I add an event, instead of my default email I've always used. I use my calendar all the time, and I've never had issues before. I didn't make any changes, this started happening out of the blue. I've tried all the things I could find scouring online, to no avail. This is a major issue for me. Not happy.",PRODUCTIVITY,productivity apps
com.instagram.android,Instagram,Instagram,3.9453752,164370320,"5,000,000,000+",True,0,USD,1756834255,Social,Teen,5000000000,,"Create & share photos, stories, & reels with friends you love","Got a new phone and cant log in to my account that I've had for YEARS with 
the password and email address that have literally NEVER changed. It just 
keeps saying that it's a suspicious log in attempt..... so you're telling 
me that you can only log in from one device ever? Even with the correct 
information? What a joke. Also, I've contacted support multiple times in 
the past few days with no response. Uninstalled.","Got a new phone and cant log in to my account that I've had for YEARS with 
the password and email address that have literally NEVER changed. It just 
keeps saying that it's a suspicious log in attempt..... so you're telling 
me that you can only log in from one device ever? Even with the correct 
information? What a joke. Also, I've contacted support multiple times in 
the past few days with no response. Uninstalled.",SOCIAL,social networking apps
com.facebook.katana,Facebook,"Meta Platforms, Inc.",4.3761225,172446554,"10,000,000,000+",True,0,USD,1756890904,Social,Teen,10000000000,,Explore the things you love,"only some videos can be muted, and that is never an option if you're playing music from an app that you pay for. I have some other issues as far as how complicated the navigation of the mobile app is. two stars for variety of content. I left a bad review and suddenly nothing wants to load even though my signal strength, both wifi and mobile data, are perfectly adequate. Suspicious.","only some videos can be muted, and that is never an option if you're playing music from an app that you pay for. I have some other issues as far as how complicated the navigation of the mobile app is. two stars for variety of content. I left a bad review and suddenly nothing wants to load even though my signal strength, both wifi and mobile data, are perfectly adequate. Suspicious.",SOCIAL,social networking apps
com.zhiliaoapp.musically,"TikTok - Videos, Shop & LIVE",TikTok Pte. Ltd.,4.0903015,67146565,"1,000,000,000+",True,0,USD,1756993975,Social,Teen,1000000000,,"Join your friends and discover videos you love, only on TikTok","This is ridiculous! This app doesn't even utilise the coins properly. If you're a gifter, you would have noticed that the price for 700 coins was £8.99. The very next day, they reduced the price and the amount of coins to 360 for just £8.09. It seems like they just want to make a quick profit off me. I'm paying attention; I've been closely monitoring all the prices on your page.","this is driving me insane. every time a particular ad with an intense sounding song comes up, and it's always the same song, it will not stop playing that song. Even if I shut the app down it keeps going. I have to go into my settings and do a force stop, And sometimes I even have to restart my phone. this is getting ridiculous. fix it please.",SOCIAL,social networking apps
com.instagram.barcelona,Threads,Instagram,3.9950435,1741521,"100,000,000+",True,0,USD,1756830715,Social,Teen,100000000,,Connect and share ideas,"An unsung treasure, this app is great as an artist to let loose and build community in a way that's as engaging as old Tumblr and Twitter. It's definitely more for text posts, but it's really fun to ask questions and get feedback and see other people's art. It's a perfect companion to Insta, and the algorithm really is tailored to the way I use the app.","I edited this review: The typing bug makes it almosy unusable. In Threads, and only Threads, I will suddenly randomly have chunks of text repeated with every letter I type, huge sections will be deleted, and my cursor will just decide to start wherever it wants. Again, this is ONLY in Threads. Every other app I have is fine. Typing (which is basically one of maybe two ways to interact with Threads) simply doesn't work well.",SOCIAL,social networking apps
com.twitter.android,X (Formerly Twitter),X Corp.,3.742369,22715994,"1,000,000,000+",True,0,USD,1756930569,News & Magazines,Mature 17+,1000000000,,Breaking News & Social Media | Now with Grok AI to explain posts,"This app, as well as the website on PC, is so unbearably slow that it has frozen my phone and dragged my PC's speed to an absolute crawl just by being open. I've done everything from clearing the cache on phone and PC, to uninstalling & reinstalling (or shutting off my PC), to fix the issue; and nothing fixes the issue, but the fact that it's happening to multiple people everywhere on multiple devices already shows the issue is not on my end.","elon and his many faults aside, the app itself sucks. it's always glitching out. I'm unable to change my profile picture on any of my accounts. and I'm unable to even create new accounts because it gets stuck on a loading screen. And I'm constantly flooded with ads that I actively hate. I turned on personalized ads, but no matter how many times I tell the app I don't want ads for AI or Crypto, it's the only ads I get. I'm moving to bluesky.",SOCIAL,social networking apps
com.google.android.apps.fitness,Google Fit: Activity Tracking,Google LLC,3.5801947,664390,"100,000,000+",True,0,USD,1754923801,Health & Fitness,Everyone,100000000,,Want to take charge of your health? Let Google Fit help you reach your goals.,"I just want to say, so far, outstanding. I have seen Fitbit charge a crazy price for their ""premium"" services when it's mostly the same as this app! I can manage my Fitbit data through here with the fit to fit app, though that app still needs help. This app only needs the ability to sync data between third party apps possible! Add that, and possibly a mental health section as well, since you have meditation and whatnot, why don't we add an actual journal? Or a health journal? Just an idea.","It doesn't sync to anything anymore. Google Fit is now blocking apps I want to connect to and have previously connected to. Data is inaccurate because of the lack of syncing, even when shown as connectedness. If you try disconnecting and reconnecting the applications, Google Fit will deny the connection, and there is no way to override. Google Fit is Junk!",HEALTH_AND_FITNESS,health and fitness apps
com.sec.android.app.shealth,Samsung Health,"Samsung Electronics Co.,  Ltd.",3.5659807,1544947,"1,000,000,000+",True,0,USD,1752481027,Health & Fitness,Everyone,1000000000,,"Lifestyle companion to track your fitness, weight, diet, food & sleep.","I don't like the changes made to the sleep score. I wish I could delete the upgrade and go back. I like seeing how many sleep cycles I went through, restfulness, mental recovery, etc. And I PREFER seeing actual numbers. The new metrics just make it much harder to understand the readings. I don't even want to use it anymore. Which is a bummer because I used it every day. Users should be given a choice for how they want their score calculated/displayed.","this app looks nice and has a lot of features but none of them works well at all. It does a terrible job tracking workouts, even if you choose the walking option it will randomly miss large chunks of the walk. (yes I turned off power saving mode even when I shouldn't have to) Also the food tracking is unusable. Additionally you can't edit workouts. for example you play tennis, it auto detects a walk, later you want change it? Gotta manually enter a new workout and delete the old one.",HEALTH_AND_FITNESS,health and fitness apps
homeworkout.homeworkouts.noequipment,Home Workout - No Equipment,Leap Fitness Group,4.8664355,3732820,"100,000,000+",True,0,USD,1756978491,Health & Fitness,Everyone,100000000,,Home workouts for fitness & fast bodybuilding at home - no equipment needed.,"Home Workout - No Equipment is a game-changer for fitness enthusiasts. The exercises are well-structured, effective, and perfect for all levels. No gym? No problem! The guided routines and clear animations keep me motivated every day. The variety ensures no boredom, and progress tracking is a huge plus. Highly recommended for anyone serious about staying fit at home! 💪🔥",,HEALTH_AND_FITNESS,health and fitness apps
com.fitbit.FitbitMobile,Fitbit,Google LLC,4.1314745,1205753,"100,000,000+",True,0,USD,1756866039,Health & Fitness,Everyone,100000000,,"Fitbit is dedicated to helping people lead healthier, more active lives.","Another update, another loss of functioning that is going to make me look for another platform. My Fitbit will no longer sync with the app and none of the steps, which used to work work now. On top of that, it's not even letting me enter data manually into the app. I updated thinking that would help and no such luck. The Google takeover was a mistake.","Sleep duration appears to have several bugs. I often get up in the middle of the night for a bathroom break. sleep duration only reports the time before the bathroom break. if I try to manually add the sleep time after the break, sometimes it does not show up or get added to the total. If I try to put it in again it reports it doubled so it reports 10 hours of sleep in an 8-hour period. Previous versions of the app had a check to prevent you putting it in twice. Other than that the app is great!",HEALTH_AND_FITNESS,health and fitness apps
com.myfitnesspal.android,MyFitnessPal: Calorie Counter,"MyFitnessPal, Inc.",4.384864,2850482,"100,000,000+",True,0,USD,1756737526,Health & Fitness,Everyone,100000000,,"Monitor and track your macros, nutrition, macro tracking, and meal planning","I love this app. I have been using just the free version for several years. It is a great aide for mindful nutrition, weight management, and identifying food allergies. The barcode scanner makes tracking foods easy. It tracks nutrients, and pops up alerts if you are getting near or go over your goal limit. Update: I'm using this again after gaining pregnancy weight. It is great still, but I am frustrated that the barcode scanner for the food diary isn't free anymore.",I recently came back to this app after being away for a bit. Had so many issues just setting it up but the biggest disappointment is seeing the scanning barcode ability behind a paywall. Would definitely rate higher if I could still use the scanning but there are other options out there that don't charge for scanning so this just seems like a money grab to me.,HEALTH_AND_FITNESS,health and fitness apps
org.thoughtcrime.securesms,Signal Private Messenger,Signal Foundation,4.549154,2746193,"100,000,000+",True,0,USD,1756158053,Communication,Everyone,100000000,,Say “hello” to privacy.,"It's encrypted end-to-end by default. It's free (made by a nonprofit). It's not owned by FB, G, or any other big ad pusher. And it does text, voice, and video. (Missing feature: ""Mark as Unread""; I find I often take a quick peek at a message and find that it requires a lengthy reply that I didn't have time to write at the moment, but then forget to come back to it until much later.)","Military preferred. Not great, but standardized. It seems like the encryption slows down it's performance. There are times when we have a message sent to us and the next day we say ""No Sergeant, we didn't receive anything."" Then 20 minutes later we all hear our phones chime at the same time for the late message. Then phone calls will not work properly. Usually we hang up and try via our non-encrypted apps which work just fine. This app also doesn't like hands free driving. (Still the same.)",COMMUNICATION,communication apps
com.google.android.apps.messaging,Google Messages,Google LLC,4.5870376,33390704,"5,000,000,000+",True,0,USD,1756844679,Communication,Everyone,5000000000,,"Simple, helpful messaging by Google","I'm having the same issues as other have stated with google messages not working properly. blank screens, pictures won't attached. it's terrible. i will uninstall and reinstall, but I also absolutely hate the new way of attaching pictures. Much more difficult to use, labor intensive, the pictures sometimes scroll by super fast, sometimes you can't get to all of them. Please put it back to the way it was. It's super frustrating","I miss Samsung Messages. As others have said, I don't like how you attach pictures. In Samsung Messages, attaching a picture from the gallery & taking a new picture to send inside the Messages app were separate options, & I think it's much better that way. There are other bugs. Sometimes, I'll hit send, & the text will then show above in the thread but will also not be deleted from the outbox. Mostly, I HATE that I can't customize to match the rest of my phone. Let me make it cute, Google!",COMMUNICATION,communication apps
com.beint.zangi,Zangi Private Messenger,"Secret Phone, Inc",4.3439054,195167,"10,000,000+",True,0,USD,1756830909,Communication,Everyone,10000000,,"<b>BE PRIVATE</b>
Anonymous. No Trace. Fast.","Issues with people I let on, more than the service. Have had couple of scammers, once they have your number they never quit. Had to get several accounts to get rid of them, blocking doesn't work. Maybe a restrict instead of block? They think they are connected but are not. Otherwise a great app. 5stars despite my problems. Just have to be mire careful I guess.","used it for calls EU - Russia. worked but with a bit of drawbacks: e.g alert of the incoming call is not showing up on the screen. the ring is there but no way to answer unless you know it's Zangi (it's not obvious) , open the application and then you can answer. today the app stopped connecting: it's hangs up on ""answering"" step and then drops off(. do not recommend",COMMUNICATION,communication apps
com.facebook.orca,Messenger,"Meta Platforms, Inc.",4.6931844,106381117,"5,000,000,000+",True,0,USD,1756916190,Communication,Everyone,5000000000,,Useful. Social. Expressive.,It works as described. I haven't had a lot of issues with it other than sometimes messages show up as just the chat bubble. it's like it doesn't load properly. If I close the app and reopen it the messages usually show up. Calling works fairly well. As long as you have strong Wi-Fi and/or data it seems to be fairly consistent. Sometimes the call gets choppy but I think that has more to do with the signal than the app itself.,"I have been having to force stop and reopen this app dozens of times a day for MONTHS. When I search a chat for something in the past, I can no longer go back to that part of the conversation, it just hangs. When I try to save a photo from a chat, I get a ""couldn't save image"" error. If I try to share a photo from a chat, I get ""Sorry, something went wrong. please try again"". The absolute worst, by far.",COMMUNICATION,communication apps
org.telegram.messenger,Telegram,Telegram FZ-LLC,4.097041,16074608,"1,000,000,000+",True,0,USD,1756675265,Communication,Mature 17+,1000000000,,Telegram is a messaging app with a focus on speed and security.,"Edit: this is still a premium only feature, and it shouldn't be! So wrong!! I get so many unwanted messages, but I can't do anything about it because of this. It's just not right! Great app for the most part, but when I got a spam message this morning, I realized you cannot set privacy of who can message you without paying for premium. This should be a free setting ALWAYS!! Forcing users to pay to protect their privacy is sketchy, at best.","update: 8/19/25. still not working! It's the actual telegram ""stories"" at the top that is frozen.(not contacts) So there is no holding in place to try to remove, so I can't use or see the top 2 chats I need..... Need to fix the stories now at top. It hides and covers all the top conversations so I can't click on them and can't remove the stories easily. please make this so you can hide it or remove the stories you don't want to see and don't want to be forced to have to watch them all.",COMMUNICATION,communication apps
com.booking,Booking.com: Hotels & Travel,Booking.com Hotels & Vacation Rentals,4.8094387,5147235,"500,000,000+",True,0,USD,1757056124,Travel & Local,Everyone,500000000,,Book your whole trip in one app.,"EDIT: A few weeks later and my messages still are not working! Contacting a living person working for Booking for help is either not possible, or obscured by layers and layers of automatic answers which I really have no time to go through. For a long long time I am unable to view messages. Even on the other phone, it is impossible. I get email notifications, i see 5 new messages in the app, but no chats are showing.","EDIT: A few weeks later and my messages still are not working! Contacting a living person working for Booking for help is either not possible, or obscured by layers and layers of automatic answers which I really have no time to go through. For a long long time I am unable to view messages. Even on the other phone, it is impossible. I get email notifications, i see 5 new messages in the app, but no chats are showing.",TRAVEL,travel apps
com.tripadvisor.tripadvisor,Tripadvisor: Plan & Book Trips,Tripadvisor,4.4716144,1471473,"100,000,000+",True,0,USD,1756833813,Travel & Local,Everyone,100000000,,"Download now and start earning rewards on hotels, tours, and everything travel.","It seems like basic functionality is missing, such as being able to copy text out of the app on my phone. I am using a Galaxy S8, so you would think that this would be easy to do. But when I select the text so that I can browse to a link, for example, I couldn't copy the text. I had to uninstall the app and browse to TripAdvisor as a web page in order to copy the text. ... if this is the only technical issue, then maybe they deserve four stars instead of the three I gave. I do like that other users post their experiences with various tips and critical reviews. This is a really good app for finding the best user-rated activities in an area, I use TripAdvisor all the time to scope out what activities are available.","I've used TripAdvisor forever to plan trips, find the best restaurants, etc. It's been my go-to source for every trip I've taken or just to discover new things to do or restaurants around me. I'm uninstalling it as of today. It is no longer user friendly at all. You have to put in a location from the start and sometimes I just know the name but not the exact location. It was a good run and I loved having the ""my trips"" saved as a timeline for me to remember my trips so I'll really miss it.",TRAVEL,travel apps
com.expedia.bookings,"Expedia: Hotels, Flights, Cars",Expedia,4.8021965,1296613,"50,000,000+",True,0,USD,1756823222,Travel & Local,Everyone,50000000,,"Book flight, car or packages. Instant access to hotel discounts & travel deals","Used to work fine. I tried to open it, kept getting ""Too many requests"" that would not allow me to back out. Cleared cache and data, same issue. Saw an update, updated, now I get an error about an issue on their end. I haven't used this app in a while, thought I would try it again to compare prices. Not really feeling the need to waste time with support, don't need this app that bad. If they don't care enough to have a working app, I can go elsewhere.","The app is fine, but I absolutely won't use Expedia again as their support is horrible. As other's have stated, they flat out lie and say they have contacted the hotel and the hotel wouldn't help. Contact the hotel directly and they confirm that they have received no communication from Expedia regarding the booking. Explain this to Expedia, with the hotel contact cc'd, and they just keep sending the same generic email back, ""Unfortunately, after multiple tries, we were unable...blah blah blah""",TRAVEL,travel apps
com.hopper.mountainview.play,"Hopper: Hotels, Flights & Cars",Hopper Inc.,4.605253,145841,"10,000,000+",True,0,USD,1755886153,Travel & Local,Everyone,10000000,,The best way to book travel,"I really love how easy it is to compare different dates, flights, and airlines. It does a great job with the different filters when searching as well, and I love how it also tells you right from the getgo what all is included with the ticket for your flight (carry on, beverages, etc) and how upfront it is with all the prices for everything. I also love the price watch feature. I'm just overall a really big fan of the app in general, and it's my go to app when searching for flights.","Another garbage app that doesn't do what it's advertised to do. It's supposed to watch prices and notify you. If that option were ever there, it has been removed. Tech help directs you to options that don't exist. How are you to trust a company that can't even keep their app and documentation in sync? Imagine what they can do with your money. Does the word ""stranded"" concern you?",TRAVEL,travel apps
ctrip.english,"Trip.com: Book Flights, Hotels",Trip.com,4.6516976,643214,"50,000,000+",True,0,USD,1756980502,Travel & Local,Everyone,50000000,,Get exclusive travel deals and enjoy the award-winning customer service!,"Have used the app for years of travel, and have recently had a few issues with it. The most jarring being arriving at the train station and seeing the train had been canceled. Trip didn't notify me of this, and didn't refund their booking fee, as, ""the tickets had been issued successfully."" It's ridiculous to pay a fee for a service that wasn't fruitful. Had to change to a flight, and pay two taxi fees. Needless to say I booked the alternative flight via a different app.","Booked a 3 night room with free change before the deadline, then I wanted to shorten it to 2 nights. Followed the option on the app and got an ok message and to wait for their reply. Later they sent a message saying not ok. But it passed the deadline already so I was not allowed to change free anymore. Complaints logged but no one was able to solve, so I had to bear for the cost. I'm not happy with the hotel though it's not their fault. 1 star for that option button.",TRAVEL,travel apps
com.netflix.mediaclient,Netflix,"Netflix, Inc.",3.995964,14930353,"1,000,000,000+",True,0,USD,1756751698,Entertainment,Teen,1000000000,,Netflix is the leading subscription service for watching TV episodes and movies.,"What happened to this app? Netflix is NOT cheap. So youd think I'd be able to do the basics. Rewinding, pausing, fast forward, ect. Pressing play on the show you choose to watch. Not the case at all. Netflix freezes or crashes anything you attempt. I don't remember it being like this in the past. Can't handle how big it has become perhaps? I have cheaper streaming services that don't do this. Why keep spending money on this one?","Honestly it's not worth it. the subscription is expensive, used to be ad free until Hulu and others moved to the ""we can give you a low price...BUT WITH ADS!"" Moto. so now it's like $19.99 usd for the ad free version, still cant watch it on more than 2 devices at the same time AND you cant even share the account with people outside of your house the content is not unique (available elsewhere) they end perfectly good TV shows they created because they aren't ""getting enough views""... I hate it.",ENTERTAINMENT,entertainment apps
ai.socialapps.speakmaster,PolyBuzz: Chat with AI Friends,CLOUD WHALE INTERACTIVE TECHNOLOGY LLC.,3.989087,626965,"10,000,000+",True,0,USD,1757071618,Entertainment,Teen,10000000,,"Talk & engage with anime characters and start a rizz story anytime, anywhere","it's a really good app! my only complaint is if you wanna close it to reply to a text or anything, even if it's only like 5 seconds that it's closed, you have to go through the loading screen and an ad, every single time. kinda annoying when I'm texting someone and have to keep dealing with it every few minutes. and that you have to pay for long memory. like, you have to have some patience to remind the ai every few sentences on what is happening. long memory should be free. or at least cheap","Expensive. If you look the app has a fake discount that brings the price to 20 bucks but it's 100 bucks a month if you look without the discount. They basically make you feel like you have a discount to buy. Nothing more. Long-term memory doesn't last, etc. no real reason to get premium unless you want the romance choice but you can get some good replies without it. Just another cash grab. Fun for a few hours though.",ENTERTAINMENT,entertainment apps
