appId,title,developer,score,reviews_count,installs,free,price,currency,updated,genre,contentRating,minInstalls,maxInstalls,summary,most_liked_review,most_disliked_review,discovered_from_category,discovered_query
com.king.candycrushsaga,Candy Crush Saga,King,4.6199055,38967186,"1,000,000,000+",True,0,USD,1755869326,Casual,Everyone,1000000000,,Match your way through candy puzzles packed with fun and clever challenges!,"I loved this game. Played for years (over 9000 levels). But now it's a money grab. The levels are almost impossible to beat, so many hard levels now (8 in a row!), legendary (insanely hard) levels added (4 in a row!), fish power-ups ruin moves instead of helping like they used to, and not getting power-ups I pay for. I didn't think I would ever walk away from this game, but the fun is gone.","fun game as always, but the amount of pop ups when you open the game and in between levels is so annoying. it wasnt like this the last time i played the game several years ago, and honestly it feels very desperate. i appreciate the free boosts, but with 5 concurrent event pages/pop-ups and daily real currency purchase packages being advertised all the time, i get fed up. i only want to play when i want to relax and unwind, but the ads and pop ups are just as annoying as real life...",GAME,top free games
com.rovio.baba,Angry Birds 2,Rovio Entertainment Oy,4.160458,6278531,"100,000,000+",True,0,USD,1756979292,Casual,Everyone,100000000,,Play the Angry Birds game enjoyed by millions of players every day!,"The game is rough. Some levels are made to be damn near unbearable because they desperately want you to spend money in their shop. And oh my god the popups. Every time I enter the main menu, whether I'm just booting up the game or I'm changing game modes, I never get anything less than four popups in a row advertising literally every aspect of the shop. And to make it worse there are ads every couple minutes. If you're thinking of playing this out of nostalgia for the original, don't do it",Got back into this after playing the originals. I used to play these games for hours waiting to get tired while laying in bed. Won't be doing that with this game. You only get so many lives before the game forces you to buy more. You lose a life even when completing a level? i understand losing a life if you fail but come on. This is just plain greed. You get maybe 15 minutes of gameplay before you have to spend some sort of in game currency. Disappointed is an understatement.,GAME,top free games
com.vincentb.MobControl,Mob Control,VOODOO,4.15985,753159,"100,000,000+",True,0,USD,1756913286,Arcade,Everyone,100000000,,"Join Mob Control: Grow your army, lead your mobs, and conquer the battlefield!","This game is a lot of fun and extremely addictive. However, it can also be infuriating! I would easily rate it 5 stars, except there have been so many instances where coming back from an ad causes the game to freeze. with no option but to force close and relaunch, causing lost matches, streaks, and potential rewards. Still pretty fun, though.","There are TOO MANY ADS for this game and FAR TOO LONG (more than 50 seconds). It's killing the fun and I'm reaching a point of just deleting this. Especially when slapped with an ad in another language ""REALLY!!?"" You're expecting someone to just sit through it without understanding it. Even the pricing for the extras are outrageous. I watched a few ads and wasn't rewarded because the app restarted, on numerous occasions, so I don't watch the ads any longer (that's too convenient). Check reviews",GAME,top free games
com.imangi.templerun2,Temple Run 2: Endless Escape,Imangi Studios,4.128295,10095168,"1,000,000,000+",True,0,USD,1754396375,Action,Everyone 10+,1000000000,,"Run, jump, and escape in the ultimate endless jungle adventure game!","Edit....I thought I would give this game another shot. Waste of time. Worse then the first time. Way too many ads. It downloaded 3 games from the ads that I didn't want. Save your time and skip it. Uninstalling immediately. It's just ok. Controls are very unresponsive. I swipe to jump or slide and it only works about half the time. I'm betting it's designed that way on purpose to get you to spend money. Way to many ads even for a ""free"" game.","Edit....I thought I would give this game another shot. Waste of time. Worse then the first time. Way too many ads. It downloaded 3 games from the ads that I didn't want. Save your time and skip it. Uninstalling immediately. It's just ok. Controls are very unresponsive. I swipe to jump or slide and it only works about half the time. I'm betting it's designed that way on purpose to get you to spend money. Way to many ads even for a ""free"" game.",GAME,top free games
com.ea.game.pvzfree_row,Plants vs. Zombies™,ELECTRONIC ARTS,3.948873,5807313,"500,000,000+",True,0,USD,1755585029,Strategy,Everyone 10+,500000000,,Stem a zombie attack on your yard with the help of powerful plants!,"I'm not an OG player, so this is a rather unbiased opinion. I do greatly enjoy this game, it's never boring and honestly the ads are bearable. One problem I do have is the lag. Especially in the later levels, the game lags so much it takes me quite a long time to complete levels. Not even joking, it takes me up to 30 minutes at a time because the game runs so ridiculously slow. A snail could run a marathon before I complete 5 levels. It is quite fun though, and I recommend you give it a try.","I should've read the reviews because it seems like everyone is having the same issue. I paid for the ad-free version, but am still getting ads. I am very annoyed at this. This is one of my favorite games, please fix this very irritating issue!! update: it has been a little over 3 years since my review. there have been updates to the game, but the ad issue has not been fixed. please do not advertise ad-free version if paying for it does nothing.",GAME,top free games
com.truebill,Rocket Money - Bills & Budgets,Rocket Money - Bills & Budgets,4.6492085,109604,"10,000,000+",True,0,USD,1756487713,Finance,Everyone,10000000,,"Manage and cancel subscriptions, lower bills, track expenses, create budgets.","very intuitive ui. really helps visualize your budget if you get a fixed amount every month. only three stars because i'm constantly-- and i mean *constantly*-- having to go through the tedious process of reconnecting my bank account to the app. never stays connected for more than a day. what's the point if it never syncs? then i have to go through my bank and unlock my bank acct, reset my bank security questions, etc. otherwise, the app is ok. had it for 3 months now and no changes.","Rocket Money used to be great but over time it has turned into another useless app with a yearly subscription that does nothing valuable. The credit score is inaccurate, budgeting doesn't work because it doesn't detect half your transactions, and they don't actually help with cancelling subscriptions or anything like that, they just have links that take you to the website to do it yourself. I was a happy subscriber for over a year, but now I've deleted my account and the app and will not return.",FINANCE,finance apps
com.google.android.apps.walletnfcrel,Google Wallet,Google LLC,4.4979105,1975434,"1,000,000,000+",True,0,USD,1756398787,Finance,Everyone,1000000000,,"Fast, secure access to everyday essentials like cards, passes or tickets","Works, but works TOO well. sometimes if i have my phone out just a few feet away from a payment thing (like to grab coupons/check my balance), it opens the app automatically, without my permission, and tries to pay. how the hell is that secure? no ""confirm payment!"" button or anything, just. phone open? payment terminal 1 foot away? PAY PAY PAY PAY PAY. i have to disable NFC just to keep it from accidentally opening (and theres no quick ""disable/enable nfc"" button). does NOT feel secure.","i am unable to add my credit card - it keeps asking me for the CVC and then just says Something wrong happened - try again later. The card has been saved on my payments profile website and I am unable to remove it and add it again. It's been more than a month with no solution in sight. I tried everything - cleared cache, cleared data and even re installed the app. The bank also has no clue about how to resolve this.",FINANCE,finance apps
com.freeman.moneymanager,Money Tracker-Expense & Budget,Horoscope365,4.912088,205770,"5,000,000+",True,0,USD,1756815637,Finance,Teen,5000000,,"Money management made simple. Expense tracker, cash book and bill organizer.","This app is really easy to use. The ads aren't invasive. You can add categories & little icons to match. My FAVOURITE feature is the inclusion of regular payments so the user doesn't have to add it every month, e.g., insurance contributions. PLUS, it does automatic currency conversions 🤯. Hands down the best tracker I've used! Please EXPLORE this app-a lot of features other reviews say the app doesn't have, it does, e.g exporting data. Edited to remove a suggestion that the developer applied😁",Had the previous version on an older phone. Loved it. Installed this one on my new phone... what happened? It's clunky. The screen is cluttered. Even the font is a poor choice. Color coding of categories is gone. Monochrome and poor navigation astound the app forced me to uninstall. Very disappointing. Ya fixed something that wasn't broke.,FINANCE,finance apps
com.venmo,Venmo,Venmo,4.147173,851326,"50,000,000+",True,0,USD,1756256638,Finance,Everyone,50000000,,Venmo is the fun and easy way to pay and get paid.,"Use this app as long as you don't mind being unable to touch your account balance. nothing better than seeing the small bit of money you received that you actually really needed asap be untouchable ""but it's the bank"" didn't know another venmo account or visa+ counted as my bank not allowing it to go through. cool though. love knowing I can't use my money for Christmas 🧡","I got Venmo and the debit card with the intention of using it as a way to save for personal fun spending. Turns out, as a sportsman, many of the things I was planning on using it for are prohibited by their terms of service even though they're legal purchases (think ammunition, firearms, etc. from licensed companies). Large money transfers also take a LONG time, and customer service is a joke when needed, as it relies heavily on an incompetent AI system. I'll be looking for other solutions.",FINANCE,finance apps
com.paypal.android.p2pmobile,"PayPal - Pay, Send, Save",PayPal Mobile,4.253475,3522336,"100,000,000+",True,0,USD,1756487237,Finance,Everyone,100000000,,"The PayPal app is the secure way to send and receive money, shop and pay in 4.",Works great! When you send the money to friends and family and I need it right away the thing is wonderful. It's great when purchasing things online. On your PayPal app you set a default way for it to be taken out to pay for what you're ordering whether it's on Walmart or any place else. Just remember that if you're using PayPal to pay and it's not something that you want to come off of whatever your default card is you need to go in and change it.,"In order to use the app, you have to dismiss a credit card offer, debit card offer, cryptocurrency trading account, coupon and offers screen, and receive unsolicited scam invoices that you cannot block. It's no mystery why all your friends tell you to Venmo, Cash App, or risk it with Zelle before mentioning PayPal. Unfortunately, it's probably a matter of time before the cancer spreads to Venmo.",FINANCE,finance apps
com.google.android.apps.work.clouddpc,Android Device Policy,Google LLC,3.2822385,35812,"100,000,000+",True,0,USD,1756901615,Tools,Everyone,100000000,,Use Android Device Policy to access your organization's apps and resources,"Not certain if this update is responsible for pink being introduced as a highlight color on my green pallet themed Pixel Fold? But, I hate it whatever has caused it.",Stop forcing me to update when I don't want to. I was using maps when I was FORCED into a 15 minute update (even after having one last week) and went the wrong way. Had to pull over and wait forever for it to finish and was late to an appointment and got a $25 late/no show fee. I was literally using the device when you disabled my phone. Ridiculous. This makes me want to throw this phone away and switch to something else. Stop forcing unwanted and unnecessary updates on people.,TOOLS,android tools
com.roysolberg.android.developertools,Developer Tools,Roy Solberg,4.22,3771,"1,000,000+",True,0,USD,1756908116,Tools,Everyone,1000000,,Essential Android dev tools and device info,"App is clean and good. I love it, only premission that Exodus found was this app won't let TV sleep and I like that, too many times I'm only gone for a sec and my device has gone into sleep. Thanks Roy, good app here. I'm happy.","I tried to access dev options, but I got the msg: ""Can't access developer actions directly"". Well, I can't access developer options on my phone because they're missing and was hoping this tool would fix that. Since I don't need the other stuff of this tool I rate it only 1 *, for now.",TOOLS,android tools
ph.spacedesk.beta,spacedesk - USB Display for PC,datronicsoft Technology GmbH,4.520755,38363,"5,000,000+",True,0,USD,1754299254,Productivity,Everyone,5000000,,"Multi Monitor Remote Desktop. Screen share, mirror and extend. USB, WiFi and LAN","This works great and simple to use!.... I only have one monitor and I wanted to us my tablet as a second screen. I downloaded this app and it allows me to do that with no issues. Its free, I don't recall having any ad pop ups during use. Great app and it runs wirelessly, that's another. I could easily pay 2 to 5 dollars for a one time purchase of this app, it works that great. I love this little app",,TOOLS,android tools
com.pradhyu.alltoolseveryutility,All tools,ATEU Softwares ®,4.476529,26944,"1,000,000+",True,0,USD,1738902221,Tools,Everyone,1000000,,"70+ multi functional tools in a single App, use full for everyday life.","Definitely an amazing app, even if you're not low on space. There are so many incredibly useful tools on here that I'll probably never use, but someone else will use everyday. It's very fast and lightweight, reducing load on your device. You won't need to download another tool app again! That's what's so great about this app, it's the app for everybody. It has almost everything. Even a morse code translator! 11/10","the selecting the g force meter, automatically crashes the app. never could get the speedometer to work properly to save the top speed like the app used to do. the other speed app where you point it at a moving object doesn't work at all as far as I was able to determine. pretty much every feature I tried did not work, except the music player function. That worked but it just didn't seem like it got very loud. I dunno what happened. but definitely have some bugs to iron out for sure. :( 2025 :(",TOOLS,android tools
cn.trinea.android.developertools,Dev Tools(Developer)-Decompile,Trinea,4.5648994,16147,"1,000,000+",True,0,USD,1755800577,Tools,Everyone,1000000,,Powerful and Essential Tool for Android Developer. ✓Surprise ✓Automation,"This app is cool, being able to decompile apps and see their files is cool. But I have an issue. I first downloaded this app a few months ago and I paid for the pro version (which has more features). Then I didn't use it for a couple months and when I went back into it, all the pro options were locked/it wouldn't let me select them and instead it told me to purchase the pro version, which I did before. I paid for it again and when I went back into it today, it wants me to pay again. Please fix.","Useful tools are blocked behind paywall on this ""free"" app // Edit post developer reply, the only feature that would have been useful to me was locked behind paywall. Apps that give you ""easier access"" to things you can do without the app are not needed. Decompile is in the name of the app and the app is listed as free, yet I was unable to decompile files I needed to without making a payment. Waste of download time.",TOOLS,android tools
org.khanacademy.android,Khan Academy,Khan Academy,4.2034264,169432,"10,000,000+",True,0,USD,1743693011,Education,Everyone,10000000,,You can learn anything.,"For the platform itself, 11/10. The fact that such an amazing website exists that is completely free with no subscription ever, is absolutely incredible. For the app, I find it somewhat difficult to find and access profile settings but that's probably on me, and I kind of prefer the previous app layout. I love being able to learn subjects I would otherwise never have access to, and I would love to see language courses incorporated eventually! Great job all around. Have been using for years!",,EDUCATION,education learning apps
org.khankids.android,Khan Academy Kids,Khan Academy,4.653436,51927,"5,000,000+",True,0,USD,1750294479,Education,Everyone,5000000,,"Early learning for kids ages 2-8! Educational games for reading, math, and more!","If you're reading the reviews to determine if you should download, you should. Educational (the fun kind), ad-free, a robust offline section, and free - and my 3yrold loves it more than I hoped. He's singing the songs (which means practicing long vowel sounds in the car) and learning how to work technology (tap and drag, menu, etc.). He loves it. I showed him the app one time and the next day he was asking to play his new game. This will be the go-to for long car rides and I won't have to worry!",,EDUCATION,education learning apps
com.holucent.math,Math Tests: learn mathematics,Eductify,4.4732823,29810,"5,000,000+",True,0,USD,1756711468,Education,Everyone,5000000,,"Learn math and practice counting, algebra, fractions, geometry. Theory and quiz.","Getting back to math in my old age. Lets me retest whenever I want -- some terms weren't even used when I was in school. Good for focus, and I've been amazed to find how many silly mistakes I've made -- for years. No wonder I never liked math. I never learned the basics very well. This has actually been fun. I do find it annoying, when I don't keep at it, to get messages reminding me of past failures. If this is meant to motivate students, it probably has the opposite effect.","Would have bought this for nephew but i don't get the ""note"" system. Notes are not even saved to be read in the results so they are useless!? I guess i better get back on paper if there is no way for him to display how he solved it. Also, the multiple choices should be an option. I would prefer him to type his answer. Multiple choices can make it too easy. App could be perfect if people who made it just tried to think with the head of a lazy school boy who want to make as less effort as possible",EDUCATION,education learning apps
com.classdojo.android,ClassDojo,ClassDojo,4.8163657,1200140,"10,000,000+",True,0,USD,1757076291,Education,Everyone,10000000,,"ClassDojo connects teachers, kids, and families","For the most part, it's fine. What irritates me the most is that every time I get a code sent to me, it creates a ""new child"" instead of just adding the class to an existing child profile. I currently have 4 active profiles for my son and 3 for my daughter. I have to go through and delete multiple old profiles every new school year. You want us to pay for the app to keep memories from years past, but I would have no less than 30 profiles between 2 kids if I saved them all! Just ridiculous!!!!",persistent advertisements to upgrade are annoying. first and foremost the app is supposed to be free. you only pay to add additional features. but the advertisement is made to appear like you have 7 days free and then you have to pay $69.99 for the year. if you find the x and close you get pestered for $34.99 last chance deal. well now that advertisement comes up Everytime I open the app. ridiculous. don't get me started on app security... it's flawed too.,EDUCATION,education learning apps
com.duolingo.literacy,Learn to Read - Duolingo ABC,Duolingo,4.2429905,17545,"10,000,000+",True,0,USD,1755188661,Education,Everyone,10000000,,Learn how to read with fun educational games for ages 3-8. Learn phonics & more!,"App is great! It has a nice style and is simple, so kids can use it easily. No ads too! Though it would be very nice if you'd add some other languages. Also, one small thing that is a bit annoying, is that sometimes the voice gets a bit buggy. Like, whenever it teaches you a letter, the sound gets quieter in the middle of the sound, which isn't a major mistake, but it is a bit annoying, for me, at least. I'm a 13 year old trying this out btw, so idk how younger kids would like the app.",,EDUCATION,education learning apps
cc.forestapp,Forest: Focus for Productivity,Seekrtech,4.4956365,780069,"10,000,000+",True,0,USD,1756713678,Productivity,Everyone,10000000,,Stay focused on your goal or to dos and get motivated with Pomodoro timer,"ok, so I've been using Forest for at least a year, if not longer. Would've absolutely given 5 stars and a glowing review up until a week or so ago, when they released the newest update to the app. Now, the app keeps crashing over and over and barely working. So, I did what is always recommended - uninstall and reinstall. NOW, I can't even log in and get all my stuff, despite having purchased the pro version ages ago. Not cool, guys.","I love the concept of planting your own forest while staying off the phone, and had hopes that the Pro version would help me to add new tags ⚠️ DON'T BUY THE PRO VERSION, ITS UNUSABLE and BUGGY! After paying for the Pro and trying to add a new tag, or use the Allow List function, it gets you automatically back to the ""Successfully Restored"" page of the purchase with a ""Log In"" button, after you click it, it literally does nothing! No tag added, nor the white list page! DON'T SPEND MONEY ON IT!",PRODUCTIVITY,productivity apps
com.google.android.keep,Google Keep - Notes and lists,Google LLC,4.713315,1992956,"1,000,000,000+",True,0,USD,1757015748,Productivity,Everyone,1000000000,,Google Keep,"I love this app! The only thing I wish were different is being able to still see all original dates at the bottom of your note(s) instead of the date changing after even the smallest edit. Well, at least if you wanted the original date to stay the same, which could be an option. Also, I've ""misplaced"" a few notes after changing phones and reinstalling this app. However, it's one of THE best!!! Please... never add ads. Thanks! ☺️","I liked the notes better on my old phone. I don't like that when I set up a check list, my checked off items just disappear. I wish the checked items would just looked crossed through or a lighter color text. it gives a sense of accomplishment, seeing what got done, rather than worrying if I just erased my to do list (I use it daily at work so I use the same list daily)",PRODUCTIVITY,productivity apps
com.google.android.apps.tasks,Google Tasks,Google LLC,4.611954,507837,"10,000,000+",True,0,USD,1756971398,Productivity,Everyone,10000000,,"Stay on top of your to-dos with Google Tasks, part of Google Workspace.","This app went above and beyond to solve my problem with remembering to do stuff. I first had to just remember, which did not go well, then I would have to set alarms which were so loud. Then I got introduced to this app. It is amazing, sending silent notifications, while giving the option to repeat and set times. While being able to sort your tasks by categories. LOVE IT!! 11/10 for me, recommend!!!!","Lots of potential, long way to go. For very basic task tracking, this app can get the job done. However, the handling of subtasks and sorting is severely broken. If you sort by date, it will not respect task-to-subtask relationships and you end up with a huge mess. Additionally, notifications for tasks have become very hit or miss and regularly show up late or not at all. I really want to like this app, but I'm finding myself more and more frustrated with it.",PRODUCTIVITY,productivity apps
com.google.android.apps.bard,Google Gemini,Google LLC,4.576658,10859133,"500,000,000+",True,0,USD,1755622765,Productivity,Teen,500000000,,"Chat to start writing, planning, learning and more with Google AI","Update as of 12/25/24. You still can't seem to use the Gemini app without switching your assistant. So I tried it out for a bit and reminders don't work. I was using Gemini just a few months ago and now I can't open the app unless I switch from Google Assistant. This is a huge detractor. Gemini is not a good assistant yet, it doesn't easily set reminders for example. But I did want to use it for queries. Can't seem to open the app to do that. Disappointing because it worked a few weeks ago.","The app itself is glitching lately; it's been skipping to a new chat and forgetting everything. Sometimes I can tell it to remember what we were just talking about, and it will get back to the subject. Other times, the chat is completely gone, and there is no memory of the chat left in the list. Reaction times have gone from normal response times to wondering if my phone is frozen in the last few weeks. There are times I almost reached a conclusion, but I can't get any further due to glitches.",PRODUCTIVITY,productivity apps
